{"schema_version":"basket-1.0","forecast_origin":"2026-10","data_up_to":"2026-08","baskets":[{"id":"burundi-1826-basket-ration_v1","market":"Rugombo","eligible":true,"currency":"BIF","components":["cereal","pulses","oil"],"last_observed_month":"2026-08","last_cost":30482.5,"next_month":"2026-11","next_p10":27596.78,"next_p50":31250.32,"next_p90":39626.24}],"attribution":"Source: World Food Programme (WFP), food prices via the Humanitarian Data Exchange (HDX), CC BY-IGO."}