{"schema_version":"basket-1.0","forecast_origin":"2026-10","data_up_to":"2026-08","baskets":[{"id":"burkina-faso-1043-basket-ration_v1","market":"Namouno (CBM)","eligible":true,"currency":"XOF","components":["cereal","pulses"],"last_observed_month":"2026-09","last_cost":951.6,"next_month":"2026-11","next_p10":529.02,"next_p50":795.67,"next_p90":1144.82}],"attribution":"Source: World Food Programme (WFP), food prices via the Humanitarian Data Exchange (HDX), CC BY-IGO."}